Timestamp,Session ID,Postal Code,Name,Email,Industry,Education Level,Job Function Level,Company Size,Primary Goal,Connection Types,Work Environment,Collaboration Preferences,Networking Window,Day of Week,Experience,Communication,Interests,Challenges,Additional Info,Device Info,Action
2025-09-08T10:35:24.950718Z,53j2d54i3-qk2iagl5,T3E,Steven Hunt,steven13@yahoo.com,NGO,Some College,Mid-level IC,11-50,Collaborate on Projects,"Industry Influencer, Creative Professional, Peer Professional, Co-founder","Structured Environment, Private Office","Strategic Sessions, Creative Brainstorms","Early Morning, Lunch, Evening","Tuesday, Wednesday, Monday, Thursday",11-15 years,Direct,"Data Science, Design","Finding mentors, Leadership growth, Industry transition",,"{""userAgent"": ""Mozilla/5.0 (iPhone; CPU iPhone OS 17_1 like Mac OS X) AppleWebKit/605.1.15 (KHTML, like Gecko) Version/17.1 Mobile/15E148 Safari/604.1"", ""platform"": ""iPhone"", ""language"": ""fr-CA"", ""screenResolution"": ""1920x1080"", ""timezone"": ""America/Toronto"", ""timestamp"": ""2025-10-08T14:48:31.950724Z""}",Finish
2025-09-21T02:10:21.960047Z,nxi5p2qfs-7glb82mo,H3Y,Kristi Chase,kchase@gmail.com,Education,Bachelor's,Senior IC,1-10,"Collaborate on Projects, Find Co-founder, Business Development, Establish Network, Gain Clients","Career Coach, Potential Client, Strategic Partner",Collaborative Space,"Cultural Exchange Sessions, Dynamic Sessions, Planned Collaboration","Early Morning, Late Evening","Tuesday, Wednesday, Thursday, Monday",6-10 years,"Direct, Creative",Data Science,"Building a network, Skill development, Work-life balance",,"{""userAgent"": ""Mozilla/5.0 (iPad; CPU OS 17_1 like Mac OS X) AppleWebKit/605.1.15 (KHTML, like Gecko) Version/17.1 Mobile/15E148 Safari/604.1"", ""platform"": ""Android"", ""language"": ""en-CA"", ""screenResolution"": ""1440x900"", ""timezone"": ""America/Edmonton"", ""timestamp"": ""2025-10-08T14:48:31.960053Z""}",Finish
2025-09-10T10:53:58.962475Z,vtfhakrow-x4kk1r6l,V6J,Kathryn Perry,kathryn.perry@gmail.com,Business,Some College,VP,50-200,Career Advancement,Manager/Leader,Social/Dynamic,"Social Collaboration, Planned Collaboration, Structured Meetings",Evening,"Tuesday, Friday, Monday, Thursday",6-10 years,Creative,"Technology Innovation, Healthcare",Finding the right opportunities,,"{""userAgent"": ""Mozilla/5.0 (iPad; CPU OS 17_1 like Mac OS X) AppleWebKit/605.1.15 (KHTML, like Gecko) Version/17.1 Mobile/15E148 Safari/604.1"", ""platform"": ""Win32"", ""language"": ""en-CA"", ""screenResolution"": ""1366x768"", ""timezone"": ""America/Montreal"", ""timestamp"": ""2025-10-08T14:48:31.962481Z""}",Finish
2025-09-27T11:54:13.956682Z,asfqbvh0k-w3pgsf3y,L5M,Krista Roberts,krista.roberts@gmail.com,Professional,Bachelor's,Junior IC,200-500,"Build Community, Business Development, Gain Clients, Strategic Partnerships, Skill Development","C-Suite Exec, Manager/Leader, Community Leader, Thought Leader, Industry Influencer","Hybrid, Private Office","Flexible Collaboration, Creative Brainstorms","Lunch, Post-Work, Early Morning","Monday, Wednesday, Friday, Thursday",3-5 years,"Direct, Diplomatic","Finance, Creative Arts, Leadership",Finding the right opportunities,,"{""userAgent"": ""Mozilla/5.0 (Windows NT 10.0; Win64; x64) AppleWebKit/537.36 (KHTML, like Gecko) Chrome/120.0.0.0 Safari/537.36"", ""platform"": ""MacIntel"", ""language"": ""en-GB"", ""screenResolution"": ""1440x900"", ""timezone"": ""America/Montreal"", ""timestamp"": ""2025-10-08T14:48:31.956687Z""}",Finish
2025-10-06T23:12:46.958881Z,oqhvd8fbf-fheyzqqx,L5G,Frank Cordova,fcordova@hotmail.com,Healthcare,Graduate,Mid-level IC,50-200,"Strategic Partnerships, Cultural Integration, Market Expansion","Manager/Leader, Creative Professional, Mentor, C-Suite Exec","Hybrid, Quiet/Focused","Creative Brainstorms, Structured Meetings, Social Collaboration","Early Morning, Late Evening, Afternoon","Thursday, Wednesday",0-2 years,"Creative, Analytical",Creative Arts,Building confidence,,"{""userAgent"": ""Mozilla/5.0 (iPad; CPU OS 17_1 like Mac OS X) AppleWebKit/605.1.15 (KHTML, like Gecko) Version/17.1 Mobile/15E148 Safari/604.1"", ""platform"": ""MacIntel"", ""language"": ""en-US"", ""screenResolution"": ""2560x1440"", ""timezone"": ""America/Edmonton"", ""timestamp"": ""2025-10-08T14:48:31.958886Z""}",Finish
2025-09-19T02:48:33.962404Z,gsem2fitg-uktq5smv,V6G,Daniel Lee,daniel57@hotmail.com,Finance,Bachelor's,Manager,50-200,"Gain Clients, Business Development","Community Leader, Manager/Leader, Industry Influencer, C-Suite Exec, Thought Leader","Private Office, Hybrid","Social Collaboration, Impromptu Brainstorms",Afternoon,"Wednesday, Thursday",3-5 years,Analytical,"Technology Innovation, Data Science, Entrepreneurship","Industry transition, Building confidence",,"{""userAgent"": ""Mozilla/5.0 (Macintosh; Intel Mac OS X 10_15_7) AppleWebKit/537.36 (KHTML, like Gecko) Chrome/120.0.0.0 Safari/537.36"", ""platform"": ""MacIntel"", ""language"": ""fr-CA"", ""screenResolution"": ""360x640"", ""timezone"": ""America/Winnipeg"", ""timestamp"": ""2025-10-08T14:48:31.962410Z""}",Finish
2025-09-18T11:12:19.959002Z,1t3uzzzul-yzlgjvbv,H3X,Megan Wilson,megan.wilson@gmail.com,Law,Bachelor's,Mid-level IC,50-200,Cultural Integration,"Manager/Leader, Career Coach, C-Suite Exec, Strategic Partner",Structured Environment,Flexible Collaboration,Evening,Friday,0-2 years,Creative,Data Science,"Skill development, Finding mentors, Finding the right opportunities",,"{""userAgent"": ""Mozilla/5.0 (Windows NT 10.0; Win64; x64; rv:109.0) Gecko/20100101 Firefox/121.0"", ""platform"": ""iPad"", ""language"": ""en-GB"", ""screenResolution"": ""1440x900"", ""timezone"": ""America/Halifax"", ""timestamp"": ""2025-10-08T14:48:31.959007Z""}",Finish
2025-09-19T08:17:15.958316Z,p6xcw8afm-ne6x1jd3,H3V,Cynthia Butler,cynthia.butler@hotmail.com,Marketing,Some College,Mid-level IC,11-50,Secure Funding,"Creative Professional, Thought Leader, Strategic Partner, Mentor","Social/Dynamic, Collaborative Space","Cultural Exchange Sessions, Structured Meetings","Lunch, Post-Work, Early Morning, Evening","Wednesday, Monday, Thursday",0-2 years,Creative,Sustainability,Industry transition,I'm particularly interested in technology and looking to expand my network in this area.,"{""userAgent"": ""Mozilla/5.0 (Macintosh; Intel Mac OS X 10_15_7) AppleWebKit/537.36 (KHTML, like Gecko) Safari/537.36"", ""platform"": ""iPhone"", ""language"": ""en-US"", ""screenResolution"": ""1366x768"", ""timezone"": ""America/Vancouver"", ""timestamp"": ""2025-10-08T14:48:31.958321Z""}",Finish
2025-09-29T02:35:19.952193Z,nrvbjfvyb-6li076a3,H3W,Stephen Jones,stephen.jones@gmail.com,Student,Bachelor's,Senior Manager,50-200,"Thought Leadership, Gain Clients, Job Opportunities, Skill Development, Professional Development","Thought Leader, Mentor, Strategic Partner",Quiet/Focused,Strategic Sessions,"Evening, Afternoon","Thursday, Monday, Wednesday, Tuesday",16+ years,Diplomatic,Data Science,"Building confidence, Skill development, Finding mentors",,"{""userAgent"": ""Mozilla/5.0 (Linux; Android 13) AppleWebKit/537.36 (KHTML, like Gecko) Chrome/120.0.0.0 Mobile Safari/537.36"", ""platform"": ""Android"", ""language"": ""en-US"", ""screenResolution"": ""1440x900"", ""timezone"": ""America/Vancouver"", ""timestamp"": ""2025-10-08T14:48:31.952199Z""}",Finish
2025-10-02T01:08:19.955238Z,2yj0974wx-ub0gz1vh,M6J,Victoria Boyd,vboyd@yahoo.com,Professional,Some College,VP,11-50,Business Development,"Domain Expert, Investor/VC, Thought Leader, Community Leader, Strategic Partner",Social/Dynamic,"Cultural Exchange Sessions, Collaborative Workshops","Evening, Lunch, Post-Work","Tuesday, Friday, Thursday",6-10 years,Diplomatic,"Sustainability, Research, Entrepreneurship",Building a network,,"{""userAgent"": ""Mozilla/5.0 (Macintosh; Intel Mac OS X 10_15_7) AppleWebKit/537.36 (KHTML, like Gecko) Safari/537.36"", ""platform"": ""Linux x86_64"", ""language"": ""en-US"", ""screenResolution"": ""1536x864"", ""timezone"": ""America/Montreal"", ""timestamp"": ""2025-10-08T14:48:31.955244Z""}",Finish
2025-09-27T02:21:40.958941Z,zkiew6or6-xn6lcpy9,M6P,Michael Nicholson,mnicholson@hotmail.com,Finance,Some College,VP,1-10,"Secure Funding, Job Opportunities, Build Community, Market Expansion",Career Coach,"Quiet/Focused, Social/Dynamic",Flexible Collaboration,"Afternoon, Evening, Lunch, Late Evening","Friday, Wednesday",11-15 years,Analytical,Entrepreneurship,"Leadership growth, Industry transition",,"{""userAgent"": ""Mozilla/5.0 (Windows NT 10.0; Win64; x64) AppleWebKit/537.36 (KHTML, like Gecko) Chrome/120.0.0.0 Safari/537.36"", ""platform"": ""Linux x86_64"", ""language"": ""en-GB"", ""screenResolution"": ""2560x1440"", ""timezone"": ""America/Vancouver"", ""timestamp"": ""2025-10-08T14:48:31.958946Z""}",Finish
2025-09-23T11:23:47.951100Z,jepecqnvq-hw06xkxb,T5N,Rachel Shields,rachel.shields@yahoo.com,NGO,Graduate,Senior IC,11-50,"Strategic Partnerships, Job Opportunities, Cultural Integration, Skill Development, Investment Opportunities","Industry Influencer, Thought Leader, Mentor","Quiet/Focused, Structured Environment","Collaborative Workshops, Cultural Exchange Sessions","Late Evening, Evening","Monday, Wednesday",11-15 years,"Analytical, Diplomatic",Design,Industry transition,,"{""userAgent"": ""Mozilla/5.0 (Macintosh; Intel Mac OS X 10_15_7) AppleWebKit/537.36 (KHTML, like Gecko) Chrome/120.0.0.0 Safari/537.36"", ""platform"": ""iPhone"", ""language"": ""en-GB"", ""screenResolution"": ""2560x1440"", ""timezone"": ""America/Toronto"", ""timestamp"": ""2025-10-08T14:48:31.951106Z""}",Finish
2025-10-02T03:28:33.958445Z,w2mrop2by-ee2abg9s,T2R,Christopher Roach,croach@gmail.com,Arts,Professional,Director,1-10,"Skill Development, Secure Funding, Thought Leadership","C-Suite Exec, Career Coach, Domain Expert, Thought Leader","Collaborative Space, Creative Space","Strategic Sessions, Cultural Exchange Sessions, Flexible Collaboration","Lunch, Post-Work",Wednesday,0-2 years,"Analytical, Direct","Education, Healthcare, Data Science",Industry transition,,"{""userAgent"": ""Mozilla/5.0 (Macintosh; Intel Mac OS X 10_15_7) AppleWebKit/537.36 (KHTML, like Gecko) Chrome/120.0.0.0 Safari/537.36"", ""platform"": ""MacIntel"", ""language"": ""en-GB"", ""screenResolution"": ""1366x768"", ""timezone"": ""America/Halifax"", ""timestamp"": ""2025-10-08T14:48:31.958451Z""}",Finish
2025-10-02T10:36:33.961240Z,ehdm6k6hg-q6srp7b4,V6K,Antonio Mueller,antonio.mueller@hotmail.com,Civil Service,Bachelor's,Senior IC,500+,"Business Development, Cultural Integration","Domain Expert, Peer Professional, C-Suite Exec, Strategic Partner, Potential Client","Hybrid, Collaborative Space",Impromptu Brainstorms,"Late Evening, Post-Work, Early Morning, Afternoon","Thursday, Friday",3-5 years,Analytical,"Design, Entrepreneurship","Building confidence, Finding mentors",,"{""userAgent"": ""Mozilla/5.0 (Windows NT 10.0; Win64; x64) AppleWebKit/537.36 (KHTML, like Gecko) Chrome/120.0.0.0 Safari/537.36"", ""platform"": ""iPad"", ""language"": ""en-US"", ""screenResolution"": ""1536x864"", ""timezone"": ""America/Edmonton"", ""timestamp"": ""2025-10-08T14:48:31.961246Z""}",Skip
2025-10-07T02:51:51.951305Z,0lbt3g2qz-w3c1qkbh,H3Z,Cheyenne Bass,cheyenne.bass@yahoo.com,Executive,High School,Senior IC,1-10,Market Expansion,"Co-founder, Mentor",Social/Dynamic,"Dynamic Sessions, Planned Collaboration",Post-Work,"Thursday, Wednesday",3-5 years,"Supportive, Analytical","Entrepreneurship, Social Impact","Building a network, Leadership growth, Skill development",,"{""userAgent"": ""Mozilla/5.0 (Windows NT 10.0; Win64; x64; rv:109.0) Gecko/20100101 Firefox/121.0"", ""platform"": ""iPad"", ""language"": ""en-GB"", ""screenResolution"": ""1536x864"", ""timezone"": ""America/Toronto"", ""timestamp"": ""2025-10-08T14:48:31.951310Z""}",Finish
2025-09-24T02:43:40.953608Z,vscyozpna-mlquh50o,T6K,Marie Moody,mmoody@gmail.com,Business,Professional,Senior IC,1-10,Job Opportunities,"C-Suite Exec, Potential Client, Thought Leader",Structured Environment,"Impromptu Brainstorms, Planned Collaboration, Cultural Exchange Sessions","Post-Work, Late Evening, Evening, Lunch","Monday, Tuesday, Friday",6-10 years,"Supportive, Diplomatic",Education,"Skill development, Building confidence, Work-life balance",,"{""userAgent"": ""Mozilla/5.0 (Windows NT 10.0; Win64; x64; rv:109.0) Gecko/20100101 Firefox/121.0"", ""platform"": ""Android"", ""language"": ""en-GB"", ""screenResolution"": ""1366x768"", ""timezone"": ""America/Winnipeg"", ""timestamp"": ""2025-10-08T14:48:31.953613Z""}",Skip
2025-10-06T00:47:51.955029Z,i0n6dgg5g-r0xafgov,V6B,Daniel Davenport,ddavenport@gmail.com,Executive,Graduate,Mid-level IC,11-50,"Strategic Partnerships, Creative Collaboration","Thought Leader, Domain Expert, Peer Professional, Industry Influencer","Hybrid, Private Office",Social Collaboration,"Early Morning, Lunch, Afternoon","Friday, Thursday",16+ years,"Analytical, Supportive","Creative Arts, Finance",Finding mentors,,"{""userAgent"": ""Mozilla/5.0 (Windows NT 10.0; Win64; x64; rv:109.0) Gecko/20100101 Firefox/121.0"", ""platform"": ""Android"", ""language"": ""en-GB"", ""screenResolution"": ""2560x1440"", ""timezone"": ""America/Halifax"", ""timestamp"": ""2025-10-08T14:48:31.955035Z""}",Finish
2025-09-15T04:53:49.957813Z,loikivqa7-izq2nmnr,M5L,Sierra Williams,swilliams@gmail.com,Government,Graduate,C-Suite,11-50,"Find Co-founder, Professional Development, Business Development, Gain Clients, Collaborate on Projects","Investor/VC, Industry Influencer, Domain Expert","Private Office, Social/Dynamic","Cultural Exchange Sessions, Social Collaboration, Collaborative Workshops","Evening, Post-Work",Wednesday,0-2 years,"Diplomatic, Analytical","Education, Social Impact, Data Science","Finding the right opportunities, Building confidence, Industry transition",Open to mentoring opportunities and collaborative projects in healthcare.,"{""userAgent"": ""Mozilla/5.0 (Windows NT 10.0; Win64; x64; rv:109.0) Gecko/20100101 Firefox/121.0"", ""platform"": ""Linux x86_64"", ""language"": ""fr-CA"", ""screenResolution"": ""1440x900"", ""timezone"": ""America/Montreal"", ""timestamp"": ""2025-10-08T14:48:31.957818Z""}",Finish
2025-09-15T09:54:07.953971Z,0tvdji1oa-hnox8fk2,T5N,Kimberly Diaz,kimberly.diaz@yahoo.com,Education,Graduate,Manager,50-200,"Strategic Partnerships, Gain Clients","Creative Professional, Co-founder, Thought Leader",Hybrid,"Planned Collaboration, Strategic Sessions, Structured Meetings","Post-Work, Lunch, Afternoon, Late Evening","Thursday, Tuesday",6-10 years,Supportive,Creative Arts,"Industry transition, Finding mentors, Building confidence",,"{""userAgent"": ""Mozilla/5.0 (iPhone; CPU iPhone OS 17_1 like Mac OS X) AppleWebKit/605.1.15 (KHTML, like Gecko) Version/17.1 Mobile/15E148 Safari/604.1"", ""platform"": ""Win32"", ""language"": ""fr-CA"", ""screenResolution"": ""2560x1440"", ""timezone"": ""America/Montreal"", ""timestamp"": ""2025-10-08T14:48:31.953976Z""}",Finish
2025-09-24T02:51:32.957400Z,yycj4q0rr-1l9gvbmq,H3B,Brian Peterson,brian.peterson@gmail.com,Civil Service,Bachelor's,Senior IC,50-200,Gain Clients,"Career Coach, Industry Influencer, Co-founder, Thought Leader","Creative Space, Collaborative Space","Collaborative Workshops, Dynamic Sessions",Post-Work,"Thursday, Monday, Tuesday, Friday",16+ years,Supportive,"Research, Data Science, Entrepreneurship","Building a network, Building confidence",,"{""userAgent"": ""Mozilla/5.0 (Windows NT 10.0; Win64; x64; rv:109.0) Gecko/20100101 Firefox/121.0"", ""platform"": ""iPhone"", ""language"": ""en-GB"", ""screenResolution"": ""1366x768"", ""timezone"": ""America/Vancouver"", ""timestamp"": ""2025-10-08T14:48:31.957406Z""}",Finish
2025-09-28T01:39:55.952130Z,jdm5fc79m-96zpxvpb,T6E,James Gonzales,jgonzales@yahoo.com,NGO,Bachelor's,Senior Manager,50-200,"Creative Collaboration, Career Advancement, Skill Development, Collaborate on Projects","Creative Professional, Investor/VC","Private Office, Social/Dynamic","Planned Collaboration, Social Collaboration, Collaborative Workshops","Early Morning, Afternoon, Evening, Lunch","Wednesday, Thursday",6-10 years,"Direct, Creative","Healthcare, Social Impact, Creative Arts",Industry transition,,"{""userAgent"": ""Mozilla/5.0 (iPhone; CPU iPhone OS 17_1 like Mac OS X) AppleWebKit/605.1.15 (KHTML, like Gecko) Version/17.1 Mobile/15E148 Safari/604.1"", ""platform"": ""Android"", ""language"": ""fr-CA"", ""screenResolution"": ""1536x864"", ""timezone"": ""America/Montreal"", ""timestamp"": ""2025-10-08T14:48:31.952136Z""}",Finish
2025-09-22T03:28:07.955404Z,vjldnhm63-q68jov58,M5R,Stephen Kim,stephen.kim@gmail.com,Tech,High School,Manager,1-10,"Cultural Integration, Find Mentor, Career Advancement, Establish Network, Job Opportunities","Community Leader, Creative Professional, Domain Expert, Strategic Partner","Hybrid, Quiet/Focused",Cultural Exchange Sessions,Evening,"Monday, Thursday, Friday",16+ years,Supportive,Sustainability,"Building a network, Finding the right opportunities",I'm particularly interested in data science and looking to expand my network in this area.,"{""userAgent"": ""Mozilla/5.0 (Windows NT 10.0; Win64; x64) AppleWebKit/537.36 (KHTML, like Gecko) Chrome/120.0.0.0 Safari/537.36"", ""platform"": ""Linux x86_64"", ""language"": ""en-GB"", ""screenResolution"": ""1366x768"", ""timezone"": ""America/Montreal"", ""timestamp"": ""2025-10-08T14:48:31.955410Z""}",Finish
2025-09-08T04:01:27.957755Z,05wh23gxr-irjutfvj,H3A,Kimberly King PhD,kphd@yahoo.com,Healthcare,Bachelor's,Founder,50-200,Cultural Integration,Strategic Partner,Private Office,"Cultural Exchange Sessions, Impromptu Brainstorms","Lunch, Late Evening, Evening",Monday,11-15 years,"Direct, Diplomatic","Sustainability, Leadership",Work-life balance,,"{""userAgent"": ""Mozilla/5.0 (Macintosh; Intel Mac OS X 10_15_7) AppleWebKit/537.36 (KHTML, like Gecko) Chrome/120.0.0.0 Safari/537.36"", ""platform"": ""MacIntel"", ""language"": ""en-CA"", ""screenResolution"": ""1536x864"", ""timezone"": ""America/Edmonton"", ""timestamp"": ""2025-10-08T14:48:31.957761Z""}",Finish
2025-10-08T02:06:30.956670Z,s8anp8dml-c8xizx35,V6P,Linda Jones,linda60@yahoo.com,Public Sector,Bachelor's,Senior Manager,50-200,"Investment Opportunities, Professional Development, Secure Funding, Business Development, Career Transition",Potential Client,Creative Space,Creative Brainstorms,"Afternoon, Post-Work, Lunch","Thursday, Tuesday, Friday, Wednesday",3-5 years,"Diplomatic, Analytical","Technology Innovation, Leadership","Skill development, Building confidence",,"{""userAgent"": ""Mozilla/5.0 (Macintosh; Intel Mac OS X 10_15_7) AppleWebKit/537.36 (KHTML, like Gecko) Chrome/120.0.0.0 Safari/537.36"", ""platform"": ""Win32"", ""language"": ""en-CA"", ""screenResolution"": ""1366x768"", ""timezone"": ""America/Winnipeg"", ""timestamp"": ""2025-10-08T14:48:31.956676Z""}",Finish
2025-09-22T12:32:51.956730Z,w4ioar4g5-8o9qjp0x,M6R,Derek Wilson,derek39@hotmail.com,Trade,Graduate,Senior IC,50-200,Job Opportunities,"Strategic Partner, Co-founder","Structured Environment, Social/Dynamic",Flexible Collaboration,"Lunch, Evening, Late Evening",Monday,16+ years,Supportive,"Research, Data Science","Skill development, Leadership growth, Finding the right opportunities",,"{""userAgent"": ""Mozilla/5.0 (Macintosh; Intel Mac OS X 10_15_7) AppleWebKit/537.36 (KHTML, like Gecko) Safari/537.36"", ""platform"": ""Linux x86_64"", ""language"": ""en-GB"", ""screenResolution"": ""360x640"", ""timezone"": ""America/Halifax"", ""timestamp"": ""2025-10-08T14:48:31.956735Z""}",Finish
2025-09-17T09:07:16.950731Z,5ju9bvm2p-9e6gbps3,T5J,Amber Glass,amber.glass@hotmail.com,Executive,Graduate,Senior Manager,50-200,"Secure Funding, Strategic Partnerships, Creative Collaboration, Business Development, Find Mentor","Potential Client, Community Leader, Manager/Leader, Investor/VC, Co-founder",Quiet/Focused,Structured Meetings,Early Morning,"Monday, Wednesday, Thursday",0-2 years,Supportive,Business Strategy,Finding the right opportunities,,"{""userAgent"": ""Mozilla/5.0 (Windows NT 10.0; Win64; x64) AppleWebKit/537.36 (KHTML, like Gecko) Chrome/120.0.0.0 Safari/537.36"", ""platform"": ""Linux x86_64"", ""language"": ""en-GB"", ""screenResolution"": ""2560x1440"", ""timezone"": ""America/Halifax"", ""timestamp"": ""2025-10-08T14:48:31.950737Z""}",Finish
2025-09-13T05:02:16.961626Z,08ct6176c-1k03u0up,H3C,Joshua Hickman,joshua17@hotmail.com,Business,Bachelor's,Senior Manager,200-500,"Business Development, Establish Network, Thought Leadership, Find Mentor, Investment Opportunities",C-Suite Exec,Collaborative Space,"Dynamic Sessions, Creative Brainstorms, Flexible Collaboration","Early Morning, Afternoon, Post-Work, Lunch","Tuesday, Monday",16+ years,Diplomatic,"Healthcare, Education","Finding mentors, Industry transition",Recently transitioned to creative arts and eager to connect with like-minded professionals.,"{""userAgent"": ""Mozilla/5.0 (Windows NT 10.0; Win64; x64) AppleWebKit/537.36 (KHTML, like Gecko) Chrome/120.0.0.0 Safari/537.36"", ""platform"": ""iPhone"", ""language"": ""en-CA"", ""screenResolution"": ""1440x900"", ""timezone"": ""America/Montreal"", ""timestamp"": ""2025-10-08T14:48:31.961631Z""}",Finish
2025-10-06T05:18:53.961940Z,4ksd9gao4-h86dd372,M6G,William Burton,william.burton@yahoo.com,Executive,Graduate,Manager,50-200,"Career Advancement, Secure Funding, Career Transition, Job Opportunities, Market Expansion","Strategic Partner, Peer Professional, C-Suite Exec, Mentor, Career Coach","Hybrid, Social/Dynamic","Cultural Exchange Sessions, Collaborative Workshops, Impromptu Brainstorms","Early Morning, Evening, Late Evening, Post-Work","Friday, Monday, Thursday, Wednesday",6-10 years,"Supportive, Diplomatic",Entrepreneurship,"Building a network, Work-life balance",,"{""userAgent"": ""Mozilla/5.0 (Macintosh; Intel Mac OS X 10_15_7) AppleWebKit/537.36 (KHTML, like Gecko) Safari/537.36"", ""platform"": ""Win32"", ""language"": ""en-GB"", ""screenResolution"": ""390x844"", ""timezone"": ""America/Montreal"", ""timestamp"": ""2025-10-08T14:48:31.961945Z""}",Skip
2025-09-16T01:34:04.953667Z,6eeamyfp9-s8gk0eey,M4K,Anthony Rush,anthony58@yahoo.com,Trade,Bachelor's,Manager,11-50,"Cultural Integration, Find Co-founder, Secure Funding","Co-founder, C-Suite Exec","Creative Space, Hybrid",Collaborative Workshops,"Post-Work, Lunch, Afternoon",Wednesday,6-10 years,"Diplomatic, Supportive",Finance,"Finding the right opportunities, Building confidence",,"{""userAgent"": ""Mozilla/5.0 (Windows NT 10.0; Win64; x64) AppleWebKit/537.36 (KHTML, like Gecko) Chrome/120.0.0.0 Safari/537.36"", ""platform"": ""MacIntel"", ""language"": ""en-GB"", ""screenResolution"": ""2560x1440"", ""timezone"": ""America/Toronto"", ""timestamp"": ""2025-10-08T14:48:31.953673Z""}",Finish
2025-09-14T09:01:18.958304Z,ppwc1qy9m-baaxa3bl,K2P,Brittany Gay,brittany.gay@yahoo.com,Executive,Professional,Senior IC,11-50,"Thought Leadership, Cultural Integration, Creative Collaboration, Find Mentor",Thought Leader,Social/Dynamic,"Dynamic Sessions, Impromptu Brainstorms, Structured Meetings","Evening, Late Evening",Thursday,16+ years,Direct,"Social Impact, Healthcare","Industry transition, Finding the right opportunities",Passionate about data science and building meaningful professional relationships.,"{""userAgent"": ""Mozilla/5.0 (Macintosh; Intel Mac OS X 10_15_7) AppleWebKit/537.36 (KHTML, like Gecko) Chrome/120.0.0.0 Safari/537.36"", ""platform"": ""MacIntel"", ""language"": ""en-CA"", ""screenResolution"": ""360x640"", ""timezone"": ""America/Toronto"", ""timestamp"": ""2025-10-08T14:48:31.958310Z""}",Finish
2025-10-08T07:01:21.954557Z,71eg1y9xc-a6qs0sza,M5S,Gregory Brown,gregory.brown@gmail.com,NGO,Some College,Senior IC,1-10,"Skill Development, Job Opportunities, Thought Leadership",Creative Professional,Structured Environment,"Strategic Sessions, Cultural Exchange Sessions, Impromptu Brainstorms",Lunch,"Monday, Tuesday, Thursday, Wednesday",6-10 years,"Creative, Diplomatic","Data Science, Finance, Sustainability",Finding the right opportunities,,"{""userAgent"": ""Mozilla/5.0 (Macintosh; Intel Mac OS X 10_15_7) AppleWebKit/537.36 (KHTML, like Gecko) Safari/537.36"", ""platform"": ""Win32"", ""language"": ""en-GB"", ""screenResolution"": ""1440x900"", ""timezone"": ""America/Winnipeg"", ""timestamp"": ""2025-10-08T14:48:31.954562Z""}",Finish
2025-09-27T04:24:36.962685Z,m6z6xtb80-u10kwcci,H3Z,Becky Johnson,becky.johnson@yahoo.com,Government,Bachelor's,Manager,50-200,"Investment Opportunities, Cultural Integration, Business Development, Professional Development, Collaborate on Projects","Investor/VC, Manager/Leader, Career Coach, Community Leader, Creative Professional",Hybrid,Impromptu Brainstorms,Lunch,"Monday, Thursday, Friday, Wednesday",11-15 years,Direct,Education,"Leadership growth, Building confidence, Finding mentors",,"{""userAgent"": ""Mozilla/5.0 (Macintosh; Intel Mac OS X 10_15_7) AppleWebKit/537.36 (KHTML, like Gecko) Safari/537.36"", ""platform"": ""MacIntel"", ""language"": ""en-CA"", ""screenResolution"": ""390x844"", ""timezone"": ""America/Vancouver"", ""timestamp"": ""2025-10-08T14:48:31.962691Z""}",Finish
