Timestamp,Session ID,Postal Code,Name,Email,Industry,Education Level,Job Function Level,Company Size,Primary Goal,Connection Types,Work Environment,Collaboration Preferences,Networking Window,Day of Week,Experience,Communication,Interests,Challenges,Additional Info,Device Info,Action
2025-09-17T05:20:01.957696Z,bhk0onsas-jtk3lirh,M4L,Terry Coffey,terry.coffey@hotmail.com,Tech,Bachelor's,Mid-level IC,500+,"Secure Funding, Professional Development, Gain Clients, Find Mentor","Domain Expert, Manager/Leader, Industry Influencer, Career Coach",Creative Space,"Flexible Collaboration, Planned Collaboration","Late Evening, Afternoon","Wednesday, Thursday, Friday, Tuesday",3-5 years,Diplomatic,"Creative Arts, Design","Industry transition, Work-life balance, Leadership growth",Recently transitioned to marketing and eager to connect with like-minded professionals.,"{""userAgent"": ""Mozilla/5.0 (Macintosh; Intel Mac OS X 10_15_7) AppleWebKit/537.36 (KHTML, like Gecko) Chrome/120.0.0.0 Safari/537.36"", ""platform"": ""Win32"", ""language"": ""en-GB"", ""screenResolution"": ""2560x1440"", ""timezone"": ""America/Vancouver"", ""timestamp"": ""2025-10-08T14:48:31.957702Z""}",Finish
2025-09-14T23:36:31.961787Z,eua73abzg-s9w27528,H3L,Latoya Brown,latoya.brown@hotmail.com,Retail,Graduate,Senior IC,50-200,Skill Development,"Career Coach, Strategic Partner, Potential Client","Quiet/Focused, Private Office","Planned Collaboration, Collaborative Workshops","Post-Work, Afternoon","Tuesday, Thursday",3-5 years,Diplomatic,"Entrepreneurship, Finance","Finding mentors, Skill development, Leadership growth",Looking forward to meeting people who share similar interests in technology.,"{""userAgent"": ""Mozilla/5.0 (Macintosh; Intel Mac OS X 10_15_7) AppleWebKit/537.36 (KHTML, like Gecko) Safari/537.36"", ""platform"": ""Linux x86_64"", ""language"": ""en-GB"", ""screenResolution"": ""1440x900"", ""timezone"": ""America/Toronto"", ""timestamp"": ""2025-10-08T14:48:31.961793Z""}",Finish
2025-09-20T02:03:26.950502Z,xaji0y6dp-bhsahxth,M5V,Tiffany Turner,tiffany69@yahoo.com,Creative Arts,High School,Mid-level IC,1-10,"Secure Funding, Investment Opportunities, Cultural Integration","Peer Professional, Co-founder, Community Leader, Investor/VC",Private Office,"Dynamic Sessions, Collaborative Workshops","Early Morning, Evening, Late Evening, Post-Work","Tuesday, Friday, Wednesday, Monday",3-5 years,Supportive,"Entrepreneurship, Technology Innovation","Building a network, Skill development",,"{""userAgent"": ""Mozilla/5.0 (Linux; Android 13) AppleWebKit/537.36 (KHTML, like Gecko) Chrome/120.0.0.0 Mobile Safari/537.36"", ""platform"": ""Win32"", ""language"": ""en-GB"", ""screenResolution"": ""390x844"", ""timezone"": ""America/Montreal"", ""timestamp"": ""2025-10-08T14:48:31.950523Z""}",Finish
2025-09-19T09:56:18.961881Z,caig5k7fh-xcby0t0i,L5G,Margaret Hill,margaret15@gmail.com,Government,Some College,Senior IC,500+,"Creative Collaboration, Investment Opportunities",Career Coach,"Collaborative Space, Private Office","Structured Meetings, Impromptu Brainstorms",Evening,"Friday, Tuesday, Wednesday, Thursday",3-5 years,Supportive,"Healthcare, Social Impact, Sustainability","Finding mentors, Building a network, Industry transition",Passionate about data science and building meaningful professional relationships.,"{""userAgent"": ""Mozilla/5.0 (Macintosh; Intel Mac OS X 10_15_7) AppleWebKit/537.36 (KHTML, like Gecko) Chrome/120.0.0.0 Safari/537.36"", ""platform"": ""Win32"", ""language"": ""fr-CA"", ""screenResolution"": ""1920x1080"", ""timezone"": ""America/Winnipeg"", ""timestamp"": ""2025-10-08T14:48:31.961887Z""}",Finish
2025-10-08T05:52:28.960269Z,lg49ffqok-vc4gtjs1,K1Z,Tara Perry,tara.perry@hotmail.com,Business,High School,Manager,11-50,"Job Opportunities, Find Mentor, Establish Network, Market Expansion",Peer Professional,"Social/Dynamic, Collaborative Space","Impromptu Brainstorms, Structured Meetings, Cultural Exchange Sessions","Lunch, Post-Work, Evening, Afternoon","Tuesday, Friday",6-10 years,"Creative, Diplomatic","Healthcare, Sustainability, Data Science","Finding mentors, Industry transition, Building a network",,"{""userAgent"": ""Mozilla/5.0 (iPhone; CPU iPhone OS 17_1 like Mac OS X) AppleWebKit/605.1.15 (KHTML, like Gecko) Version/17.1 Mobile/15E148 Safari/604.1"", ""platform"": ""Win32"", ""language"": ""en-US"", ""screenResolution"": ""390x844"", ""timezone"": ""America/Edmonton"", ""timestamp"": ""2025-10-08T14:48:31.960275Z""}",Finish
2025-10-08T03:51:12.958562Z,o5yvmtd50-3779u7c1,T5K,Krista Martinez,kmartinez@hotmail.com,Law,Bachelor's,Senior IC,200-500,"Creative Collaboration, Secure Funding, Business Development, Find Co-founder, Establish Network","Community Leader, Strategic Partner","Collaborative Space, Structured Environment","Creative Brainstorms, Flexible Collaboration","Evening, Post-Work, Lunch, Afternoon","Friday, Thursday, Wednesday, Monday",6-10 years,"Direct, Supportive","Healthcare, Data Science, Sustainability","Industry transition, Work-life balance, Finding mentors",,"{""userAgent"": ""Mozilla/5.0 (iPhone; CPU iPhone OS 17_1 like Mac OS X) AppleWebKit/605.1.15 (KHTML, like Gecko) Version/17.1 Mobile/15E148 Safari/604.1"", ""platform"": ""Linux x86_64"", ""language"": ""en-US"", ""screenResolution"": ""1440x900"", ""timezone"": ""America/Vancouver"", ""timestamp"": ""2025-10-08T14:48:31.958567Z""}",Finish
2025-09-23T11:27:33.956449Z,ypigqx245-6izc0yos,L5M,Robert Torres,robert.torres@gmail.com,Student,Some College,Senior Manager,200-500,"Investment Opportunities, Career Advancement, Skill Development, Market Expansion, Find Mentor","Industry Influencer, Strategic Partner, Career Coach",Social/Dynamic,"Dynamic Sessions, Creative Brainstorms, Structured Meetings","Evening, Lunch, Afternoon, Late Evening","Friday, Monday, Thursday, Wednesday",6-10 years,Direct,Healthcare,"Industry transition, Finding the right opportunities",,"{""userAgent"": ""Mozilla/5.0 (Windows NT 10.0; Win64; x64; rv:109.0) Gecko/20100101 Firefox/121.0"", ""platform"": ""Linux x86_64"", ""language"": ""en-US"", ""screenResolution"": ""1920x1080"", ""timezone"": ""America/Edmonton"", ""timestamp"": ""2025-10-08T14:48:31.956454Z""}",Finish
2025-09-30T23:17:09.955506Z,nbn7gggjv-sdbide6u,V6H,Brent Brooks,bbrooks@hotmail.com,NGO,Bachelor's,Director,1-10,"Creative Collaboration, Build Community",Industry Influencer,Social/Dynamic,Dynamic Sessions,"Lunch, Early Morning","Tuesday, Thursday",6-10 years,Analytical,Business Strategy,"Leadership growth, Building a network, Finding the right opportunities",,"{""userAgent"": ""Mozilla/5.0 (Windows NT 10.0; Win64; x64) AppleWebKit/537.36 (KHTML, like Gecko) Chrome/120.0.0.0 Safari/537.36"", ""platform"": ""iPad"", ""language"": ""en-GB"", ""screenResolution"": ""768x1024"", ""timezone"": ""America/Edmonton"", ""timestamp"": ""2025-10-08T14:48:31.955512Z""}",Finish
2025-10-03T00:03:27.951635Z,7upfln4rx-yj38xrg2,H3W,Isaac Turner,isaac96@yahoo.com,Executive,Graduate,Manager,1-10,"Establish Network, Career Transition","Mentor, Industry Influencer, Investor/VC, Co-founder, C-Suite Exec",Collaborative Space,"Social Collaboration, Structured Meetings, Impromptu Brainstorms",Late Evening,Monday,6-10 years,"Supportive, Direct",Creative Arts,"Leadership growth, Industry transition, Finding the right opportunities",,"{""userAgent"": ""Mozilla/5.0 (Windows NT 10.0; Win64; x64) AppleWebKit/537.36 (KHTML, like Gecko) Chrome/120.0.0.0 Safari/537.36"", ""platform"": ""iPad"", ""language"": ""en-US"", ""screenResolution"": ""1920x1080"", ""timezone"": ""America/Toronto"", ""timestamp"": ""2025-10-08T14:48:31.951641Z""}",Finish
2025-10-01T05:08:43.953301Z,7ubbrnu8c-0s41kssv,T3H,Meredith Martin,meredith32@hotmail.com,Tech,Bachelor's,Senior IC,500+,"Find Mentor, Thought Leadership","Community Leader, Creative Professional, Thought Leader, Manager/Leader, Investor/VC","Social/Dynamic, Private Office","Planned Collaboration, Creative Brainstorms",Late Evening,"Monday, Tuesday, Thursday, Friday",3-5 years,Creative,Leadership,Leadership growth,,"{""userAgent"": ""Mozilla/5.0 (iPad; CPU OS 17_1 like Mac OS X) AppleWebKit/605.1.15 (KHTML, like Gecko) Version/17.1 Mobile/15E148 Safari/604.1"", ""platform"": ""MacIntel"", ""language"": ""fr-CA"", ""screenResolution"": ""1920x1080"", ""timezone"": ""America/Montreal"", ""timestamp"": ""2025-10-08T14:48:31.953307Z""}",Finish
2025-09-19T01:41:15.962581Z,b0qm6ut6f-izhjmxsn,L5H,Kimberly Nelson,kimberly.nelson@gmail.com,Service,Graduate,Manager,50-200,"Build Community, Strategic Partnerships, Cultural Integration, Find Mentor, Gain Clients","Peer Professional, Career Coach, Co-founder, Community Leader, Potential Client",Creative Space,"Creative Brainstorms, Strategic Sessions","Lunch, Post-Work, Evening","Wednesday, Tuesday",11-15 years,Diplomatic,Entrepreneurship,"Finding the right opportunities, Building confidence, Skill development",,"{""userAgent"": ""Mozilla/5.0 (iPhone; CPU iPhone OS 17_1 like Mac OS X) AppleWebKit/605.1.15 (KHTML, like Gecko) Version/17.1 Mobile/15E148 Safari/604.1"", ""platform"": ""Android"", ""language"": ""fr-CA"", ""screenResolution"": ""2560x1440"", ""timezone"": ""America/Edmonton"", ""timestamp"": ""2025-10-08T14:48:31.962586Z""}",Finish
2025-09-17T23:08:51.959988Z,0yx2tbt68-lzf4nub5,H3W,Julie Simpson,jsimpson@gmail.com,Business,Graduate,Senior IC,50-200,"Skill Development, Cultural Integration","Industry Influencer, Investor/VC",Collaborative Space,"Social Collaboration, Strategic Sessions","Afternoon, Early Morning","Tuesday, Thursday, Friday",11-15 years,"Diplomatic, Direct","Technology Innovation, Business Strategy, Education","Building confidence, Industry transition",Passionate about data science and building meaningful professional relationships.,"{""userAgent"": ""Mozilla/5.0 (Windows NT 10.0; Win64; x64; rv:109.0) Gecko/20100101 Firefox/121.0"", ""platform"": ""Linux x86_64"", ""language"": ""en-US"", ""screenResolution"": ""360x640"", ""timezone"": ""America/Montreal"", ""timestamp"": ""2025-10-08T14:48:31.959994Z""}",Finish
2025-10-05T11:15:44.958422Z,rzjk9e0oa-whn2eclc,L5K,Karina Cooper,karina.cooper@gmail.com,Creative Arts,Graduate,Manager,1-10,"Cultural Integration, Build Community, Find Mentor",Domain Expert,Social/Dynamic,"Collaborative Workshops, Social Collaboration","Evening, Afternoon, Lunch","Thursday, Friday, Tuesday",6-10 years,"Analytical, Direct",Business Strategy,"Industry transition, Finding mentors, Finding the right opportunities",,"{""userAgent"": ""Mozilla/5.0 (iPhone; CPU iPhone OS 17_1 like Mac OS X) AppleWebKit/605.1.15 (KHTML, like Gecko) Version/17.1 Mobile/15E148 Safari/604.1"", ""platform"": ""Linux x86_64"", ""language"": ""en-US"", ""screenResolution"": ""1536x864"", ""timezone"": ""America/Vancouver"", ""timestamp"": ""2025-10-08T14:48:31.958427Z""}",Finish
2025-09-16T03:02:25.951887Z,xjn6fokzi-xzareiya,H3H,Jason Elliott,jason.elliott@hotmail.com,Education,Bachelor's,Manager,200-500,"Build Community, Professional Development","Creative Professional, Peer Professional, Thought Leader, C-Suite Exec",Collaborative Space,"Cultural Exchange Sessions, Social Collaboration","Lunch, Late Evening, Evening, Afternoon",Monday,6-10 years,Creative,"Design, Data Science","Leadership growth, Building confidence",Open to mentoring opportunities and collaborative projects in education.,"{""userAgent"": ""Mozilla/5.0 (iPad; CPU OS 17_1 like Mac OS X) AppleWebKit/605.1.15 (KHTML, like Gecko) Version/17.1 Mobile/15E148 Safari/604.1"", ""platform"": ""Win32"", ""language"": ""en-GB"", ""screenResolution"": ""2560x1440"", ""timezone"": ""America/Vancouver"", ""timestamp"": ""2025-10-08T14:48:31.951893Z""}",Finish
2025-09-28T12:29:26.957590Z,tf0mgoqmk-31rtmpv5,H3S,David Davis,david.davis@yahoo.com,Business,Graduate,Director,11-50,"Job Opportunities, Strategic Partnerships",Career Coach,"Collaborative Space, Private Office","Creative Brainstorms, Structured Meetings",Late Evening,Thursday,6-10 years,"Analytical, Creative","Finance, Technology Innovation, Leadership",Skill development,,"{""userAgent"": ""Mozilla/5.0 (Windows NT 10.0; Win64; x64; rv:109.0) Gecko/20100101 Firefox/121.0"", ""platform"": ""iPad"", ""language"": ""en-CA"", ""screenResolution"": ""1920x1080"", ""timezone"": ""America/Montreal"", ""timestamp"": ""2025-10-08T14:48:31.957596Z""}",Finish
2025-09-22T10:36:33.953784Z,hjku2w8zu-vjutpmc3,T3H,Sara Smith,ssmith@yahoo.com,Finance,Some College,Senior IC,50-200,"Cultural Integration, Career Advancement, Creative Collaboration, Find Co-founder",Investor/VC,Creative Space,"Strategic Sessions, Creative Brainstorms, Collaborative Workshops","Afternoon, Post-Work, Evening","Thursday, Friday, Tuesday, Monday",6-10 years,Direct,"Healthcare, Finance, Technology Innovation","Industry transition, Building confidence",,"{""userAgent"": ""Mozilla/5.0 (iPhone; CPU iPhone OS 17_1 like Mac OS X) AppleWebKit/605.1.15 (KHTML, like Gecko) Version/17.1 Mobile/15E148 Safari/604.1"", ""platform"": ""Linux x86_64"", ""language"": ""en-CA"", ""screenResolution"": ""768x1024"", ""timezone"": ""America/Edmonton"", ""timestamp"": ""2025-10-08T14:48:31.953789Z""}",Finish
2025-09-15T22:32:36.962627Z,yjeedp2na-fh6q9y4y,V6T,Justin Fry,jfry@gmail.com,Medicine,Some College,Mid-level IC,1-10,Professional Development,"Creative Professional, Domain Expert, Career Coach, Investor/VC",Quiet/Focused,Flexible Collaboration,"Evening, Lunch, Post-Work, Late Evening","Wednesday, Tuesday",3-5 years,"Diplomatic, Analytical","Social Impact, Technology Innovation",Skill development,I'm particularly interested in strategy and looking to expand my network in this area.,"{""userAgent"": ""Mozilla/5.0 (Windows NT 10.0; Win64; x64; rv:109.0) Gecko/20100101 Firefox/121.0"", ""platform"": ""Android"", ""language"": ""en-GB"", ""screenResolution"": ""1366x768"", ""timezone"": ""America/Montreal"", ""timestamp"": ""2025-10-08T14:48:31.962633Z""}",Finish
2025-10-05T23:50:01.960936Z,4bd6nz1z9-zo2i5wll,M4Y,Natasha Wall,natasha14@gmail.com,Marketing,Bachelor's,Manager,200-500,"Secure Funding, Creative Collaboration, Professional Development, Strategic Partnerships, Find Mentor","Community Leader, Thought Leader, Peer Professional, Domain Expert, Investor/VC",Quiet/Focused,"Planned Collaboration, Structured Meetings, Dynamic Sessions","Afternoon, Lunch, Post-Work","Friday, Tuesday",3-5 years,"Creative, Analytical","Healthcare, Technology Innovation, Creative Arts","Industry transition, Finding the right opportunities, Building confidence",,"{""userAgent"": ""Mozilla/5.0 (Linux; Android 13) AppleWebKit/537.36 (KHTML, like Gecko) Chrome/120.0.0.0 Mobile Safari/537.36"", ""platform"": ""MacIntel"", ""language"": ""fr-CA"", ""screenResolution"": ""360x640"", ""timezone"": ""America/Edmonton"", ""timestamp"": ""2025-10-08T14:48:31.960941Z""}",Finish
2025-09-21T11:30:00.960599Z,qvbdim28a-qwd1bqfd,M5C,Crystal Turner,crystal.turner@yahoo.com,Civil Service,Graduate,Junior IC,200-500,"Job Opportunities, Creative Collaboration, Collaborate on Projects, Secure Funding","Domain Expert, Community Leader",Collaborative Space,Planned Collaboration,"Early Morning, Late Evening, Afternoon","Monday, Wednesday",6-10 years,"Diplomatic, Supportive",Sustainability,Finding mentors,,"{""userAgent"": ""Mozilla/5.0 (iPad; CPU OS 17_1 like Mac OS X) AppleWebKit/605.1.15 (KHTML, like Gecko) Version/17.1 Mobile/15E148 Safari/604.1"", ""platform"": ""iPad"", ""language"": ""en-GB"", ""screenResolution"": ""2560x1440"", ""timezone"": ""America/Halifax"", ""timestamp"": ""2025-10-08T14:48:31.960605Z""}",Finish
2025-09-21T11:01:08.955168Z,2mm4p61nh-vcfwr2f5,M5L,Julie Howard,julie69@yahoo.com,Creative Arts,Professional,Mid-level IC,1-10,"Market Expansion, Creative Collaboration, Cultural Integration, Skill Development, Strategic Partnerships","C-Suite Exec, Creative Professional, Strategic Partner, Potential Client",Hybrid,"Cultural Exchange Sessions, Creative Brainstorms","Afternoon, Late Evening, Evening, Lunch","Thursday, Wednesday, Monday",11-15 years,Direct,"Leadership, Education",Industry transition,Recently transitioned to trade and eager to connect with like-minded professionals.,"{""userAgent"": ""Mozilla/5.0 (Windows NT 10.0; Win64; x64; rv:109.0) Gecko/20100101 Firefox/121.0"", ""platform"": ""MacIntel"", ""language"": ""en-GB"", ""screenResolution"": ""390x844"", ""timezone"": ""America/Vancouver"", ""timestamp"": ""2025-10-08T14:48:31.955173Z""}",Finish
2025-10-06T23:40:18.953253Z,y0z4evldq-lovyv3lx,M5W,James Burns,jburns@gmail.com,Creative Arts,Bachelor's,Senior IC,11-50,"Career Advancement, Creative Collaboration, Career Transition",Industry Influencer,"Hybrid, Creative Space","Structured Meetings, Strategic Sessions, Social Collaboration","Late Evening, Lunch, Afternoon, Early Morning","Wednesday, Monday, Tuesday, Thursday",0-2 years,Analytical,"Social Impact, Research","Skill development, Building confidence, Leadership growth",I'm particularly interested in data science and looking to expand my network in this area.,"{""userAgent"": ""Mozilla/5.0 (iPhone; CPU iPhone OS 17_1 like Mac OS X) AppleWebKit/605.1.15 (KHTML, like Gecko) Version/17.1 Mobile/15E148 Safari/604.1"", ""platform"": ""Android"", ""language"": ""en-US"", ""screenResolution"": ""1366x768"", ""timezone"": ""America/Halifax"", ""timestamp"": ""2025-10-08T14:48:31.953259Z""}",Finish
2025-10-01T11:02:09.960446Z,u5a2x54u4-4qunf57v,M5L,Kyle Smith,ksmith@gmail.com,Executive,High School,Manager,200-500,"Secure Funding, Creative Collaboration, Establish Network",Domain Expert,Collaborative Space,Strategic Sessions,"Post-Work, Afternoon, Lunch","Friday, Thursday, Monday, Tuesday",3-5 years,Diplomatic,"Design, Creative Arts","Leadership growth, Building confidence",,"{""userAgent"": ""Mozilla/5.0 (iPad; CPU OS 17_1 like Mac OS X) AppleWebKit/605.1.15 (KHTML, like Gecko) Version/17.1 Mobile/15E148 Safari/604.1"", ""platform"": ""Android"", ""language"": ""fr-CA"", ""screenResolution"": ""1920x1080"", ""timezone"": ""America/Halifax"", ""timestamp"": ""2025-10-08T14:48:31.960452Z""}",Finish
2025-09-30T10:34:26.961660Z,uzn4u38bw-tb5q787x,T2G,Emily Rodriguez,emily.rodriguez@yahoo.com,Tech,Bachelor's,Junior IC,50-200,"Career Transition, Build Community, Job Opportunities, Market Expansion","Potential Client, Investor/VC","Quiet/Focused, Social/Dynamic","Collaborative Workshops, Planned Collaboration, Impromptu Brainstorms",Afternoon,"Monday, Wednesday, Thursday, Friday",11-15 years,Creative,"Finance, Business Strategy",Building a network,,"{""userAgent"": ""Mozilla/5.0 (Windows NT 10.0; Win64; x64) AppleWebKit/537.36 (KHTML, like Gecko) Chrome/120.0.0.0 Safari/537.36"", ""platform"": ""MacIntel"", ""language"": ""fr-CA"", ""screenResolution"": ""1536x864"", ""timezone"": ""America/Halifax"", ""timestamp"": ""2025-10-08T14:48:31.961666Z""}",Finish
2025-10-05T11:42:28.952345Z,7lay64yfd-s0dji9kq,M5C,Nathan Freeman,nathan.freeman@hotmail.com,Arts,Some College,Mid-level IC,50-200,"Business Development, Creative Collaboration, Secure Funding","Manager/Leader, Strategic Partner",Creative Space,Strategic Sessions,"Lunch, Afternoon, Early Morning","Friday, Thursday, Tuesday, Wednesday",0-2 years,"Direct, Analytical","Design, Entrepreneurship, Social Impact",Skill development,,"{""userAgent"": ""Mozilla/5.0 (Linux; Android 13) AppleWebKit/537.36 (KHTML, like Gecko) Chrome/120.0.0.0 Mobile Safari/537.36"", ""platform"": ""Linux x86_64"", ""language"": ""fr-CA"", ""screenResolution"": ""390x844"", ""timezone"": ""America/Edmonton"", ""timestamp"": ""2025-10-08T14:48:31.952351Z""}",Finish
2025-10-05T07:22:35.955075Z,5jrnj6225-92ffq293,V6H,Debra Ortiz,debra.ortiz@hotmail.com,Tech,Bachelor's,Senior IC,11-50,"Job Opportunities, Build Community, Secure Funding","Thought Leader, Investor/VC","Quiet/Focused, Hybrid",Strategic Sessions,"Afternoon, Post-Work, Evening, Early Morning","Friday, Tuesday, Wednesday, Monday",3-5 years,"Supportive, Analytical",Data Science,"Finding mentors, Finding the right opportunities, Leadership growth",,"{""userAgent"": ""Mozilla/5.0 (Windows NT 10.0; Win64; x64) AppleWebKit/537.36 (KHTML, like Gecko) Chrome/120.0.0.0 Safari/537.36"", ""platform"": ""MacIntel"", ""language"": ""fr-CA"", ""screenResolution"": ""1366x768"", ""timezone"": ""America/Vancouver"", ""timestamp"": ""2025-10-08T14:48:31.955081Z""}",Finish
2025-09-12T10:52:46.961986Z,ewyb40t3d-7xtx42d1,H3W,Jennifer Hayes,jennifer.hayes@yahoo.com,Medicine,Bachelor's,Manager,50-200,"Professional Development, Market Expansion, Build Community, Secure Funding","Potential Client, Peer Professional, Career Coach",Hybrid,Flexible Collaboration,Lunch,"Thursday, Monday, Friday",11-15 years,Supportive,Leadership,"Work-life balance, Industry transition, Skill development",,"{""userAgent"": ""Mozilla/5.0 (Macintosh; Intel Mac OS X 10_15_7) AppleWebKit/537.36 (KHTML, like Gecko) Chrome/120.0.0.0 Safari/537.36"", ""platform"": ""iPhone"", ""language"": ""en-GB"", ""screenResolution"": ""1920x1080"", ""timezone"": ""America/Toronto"", ""timestamp"": ""2025-10-08T14:48:31.961991Z""}",Finish
2025-09-11T00:31:04.954957Z,plbbb0hq6-dg8nkdat,L5B,Penny Gomez MD,penny.gomez.md@hotmail.com,NGO,High School,Senior IC,1-10,"Investment Opportunities, Find Mentor","Industry Influencer, C-Suite Exec, Investor/VC, Domain Expert",Collaborative Space,"Flexible Collaboration, Cultural Exchange Sessions, Planned Collaboration","Afternoon, Late Evening, Early Morning, Evening",Tuesday,6-10 years,Diplomatic,Social Impact,Building a network,Happy to help others in student. Let's connect!,"{""userAgent"": ""Mozilla/5.0 (Linux; Android 13) AppleWebKit/537.36 (KHTML, like Gecko) Chrome/120.0.0.0 Mobile Safari/537.36"", ""platform"": ""Linux x86_64"", ""language"": ""fr-CA"", ""screenResolution"": ""1440x900"", ""timezone"": ""America/Halifax"", ""timestamp"": ""2025-10-08T14:48:31.954962Z""}",Finish
2025-09-20T22:39:43.960364Z,pt00e2qmk-3uhk6hmr,M5S,Eric Mcclain,eric.mcclain@gmail.com,Finance,Some College,Manager,11-50,"Creative Collaboration, Find Co-founder, Establish Network","Strategic Partner, Investor/VC, Potential Client, Mentor","Private Office, Creative Space","Flexible Collaboration, Strategic Sessions",Lunch,"Wednesday, Friday",3-5 years,"Diplomatic, Analytical","Technology Innovation, Research","Finding mentors, Leadership growth, Skill development",,"{""userAgent"": ""Mozilla/5.0 (iPhone; CPU iPhone OS 17_1 like Mac OS X) AppleWebKit/605.1.15 (KHTML, like Gecko) Version/17.1 Mobile/15E148 Safari/604.1"", ""platform"": ""Win32"", ""language"": ""en-GB"", ""screenResolution"": ""2560x1440"", ""timezone"": ""America/Toronto"", ""timestamp"": ""2025-10-08T14:48:31.960369Z""}",Finish
2025-10-03T09:59:20.950704Z,tpbn78bmy-ymu5907i,H3C,Brett Schultz,brett35@yahoo.com,Business,Bachelor's,Senior IC,1-10,"Thought Leadership, Creative Collaboration, Find Co-founder, Market Expansion","Co-founder, Community Leader, Mentor",Social/Dynamic,"Impromptu Brainstorms, Flexible Collaboration, Collaborative Workshops","Early Morning, Afternoon, Late Evening","Wednesday, Tuesday",3-5 years,"Direct, Supportive","Research, Sustainability","Finding the right opportunities, Building a network, Building confidence",,"{""userAgent"": ""Mozilla/5.0 (Macintosh; Intel Mac OS X 10_15_7) AppleWebKit/537.36 (KHTML, like Gecko) Chrome/120.0.0.0 Safari/537.36"", ""platform"": ""Win32"", ""language"": ""fr-CA"", ""screenResolution"": ""768x1024"", ""timezone"": ""America/Halifax"", ""timestamp"": ""2025-10-08T14:48:31.950711Z""}",Finish
2025-09-20T01:17:48.959849Z,lu27xnpzc-u7mpa7dz,H3L,Heather Green,heather.green@yahoo.com,Student,Graduate,Senior Manager,11-50,"Secure Funding, Job Opportunities","Domain Expert, Co-founder","Social/Dynamic, Creative Space",Flexible Collaboration,"Lunch, Early Morning, Post-Work","Tuesday, Wednesday",11-15 years,Supportive,"Sustainability, Entrepreneurship, Business Strategy","Skill development, Leadership growth",Recently transitioned to civil service and eager to connect with like-minded professionals.,"{""userAgent"": ""Mozilla/5.0 (iPhone; CPU iPhone OS 17_1 like Mac OS X) AppleWebKit/605.1.15 (KHTML, like Gecko) Version/17.1 Mobile/15E148 Safari/604.1"", ""platform"": ""iPhone"", ""language"": ""fr-CA"", ""screenResolution"": ""1366x768"", ""timezone"": ""America/Toronto"", ""timestamp"": ""2025-10-08T14:48:31.959855Z""}",Finish
2025-09-23T09:02:24.954934Z,3pvarkcpw-0gkejzxp,M5P,Denise Miller,denise78@yahoo.com,Marketing,Graduate,Mid-level IC,11-50,"Cultural Integration, Thought Leadership, Skill Development",Creative Professional,"Collaborative Space, Creative Space",Dynamic Sessions,"Afternoon, Late Evening, Early Morning","Tuesday, Thursday, Wednesday",6-10 years,Supportive,Education,"Building a network, Work-life balance, Finding the right opportunities",Passionate about innovation and building meaningful professional relationships.,"{""userAgent"": ""Mozilla/5.0 (iPad; CPU OS 17_1 like Mac OS X) AppleWebKit/605.1.15 (KHTML, like Gecko) Version/17.1 Mobile/15E148 Safari/604.1"", ""platform"": ""Android"", ""language"": ""en-CA"", ""screenResolution"": ""1440x900"", ""timezone"": ""America/Winnipeg"", ""timestamp"": ""2025-10-08T14:48:31.954939Z""}",Finish
